{
  "$schema": "https://json-schema.org/draft/2020-12/schema",
  "$id": "https://agentweave.dev/contracts/agent-result.v1.schema.json",
  "title": "AgentResultV1",
  "type": "object",
  "additionalProperties": false,
  "required": [
    "schemaVersion",
    "invocationId",
    "executionId",
    "stepExecutionId",
    "status",
    "completedAt"
  ],
  "properties": {
    "schemaVersion": { "const": "1" },
    "invocationId": { "type": "string", "minLength": 1 },
    "executionId": { "type": "string", "minLength": 1 },
    "stepExecutionId": { "type": "string", "minLength": 1 },
    "status": {
      "enum": ["succeeded", "failed", "cancelled", "timed_out"]
    },
    "output": { "$ref": "#/$defs/jsonValue" },
    "error": {
      "type": "object",
      "additionalProperties": false,
      "required": ["code", "message", "retryable"],
      "properties": {
        "code": { "type": "string", "minLength": 1 },
        "message": { "type": "string", "minLength": 1 },
        "retryable": { "type": "boolean" },
        "details": {
          "type": "object",
          "additionalProperties": { "$ref": "#/$defs/jsonValue" }
        }
      }
    },
    "usage": {
      "type": "object",
      "additionalProperties": false,
      "properties": {
        "inputTokens": { "type": "integer", "minimum": 0 },
        "outputTokens": { "type": "integer", "minimum": 0 },
        "totalTokens": { "type": "integer", "minimum": 0 },
        "costUsd": { "type": "number", "minimum": 0 }
      }
    },
    "artifacts": {
      "type": "array",
      "items": {
        "type": "object",
        "additionalProperties": false,
        "required": ["id", "name"],
        "properties": {
          "id": { "type": "string", "minLength": 1 },
          "name": { "type": "string", "minLength": 1 },
          "mediaType": { "type": "string", "minLength": 1 },
          "uri": { "type": "string", "minLength": 1 },
          "metadata": {
            "type": "object",
            "additionalProperties": { "$ref": "#/$defs/jsonValue" }
          }
        }
      }
    },
    "startedAt": { "type": "string", "format": "date-time" },
    "completedAt": { "type": "string", "format": "date-time" },
    "metadata": {
      "type": "object",
      "additionalProperties": { "$ref": "#/$defs/jsonValue" }
    }
  },
  "allOf": [
    {
      "if": {
        "properties": { "status": { "const": "succeeded" } },
        "required": ["status"]
      },
      "then": {
        "not": {
          "properties": { "error": {} },
          "required": ["error"]
        }
      },
      "else": {
        "properties": { "error": {} },
        "required": ["error"]
      }
    }
  ],
  "$defs": {
    "jsonValue": {
      "oneOf": [
        { "type": "null" },
        { "type": "boolean" },
        { "type": "number" },
        { "type": "string" },
        {
          "type": "array",
          "items": { "$ref": "#/$defs/jsonValue" }
        },
        {
          "type": "object",
          "additionalProperties": { "$ref": "#/$defs/jsonValue" }
        }
      ]
    }
  }
}
