{
  "schemaVersion": "1",
  "invocationId": "invocation-conformance-1",
  "executionId": "execution-conformance-1",
  "stepExecutionId": "step-execution-conformance-1",
  "status": "timed_out",
  "error": {
    "code": "AGENT_EXECUTION_TIMEOUT",
    "message": "Agent execution exceeded its configured timeout",
    "retryable": true
  },
  "completedAt": "2026-07-26T00:15:00.000Z"
}
